{
  "evidence_id": "evidence-synthetic-0001",
  "target_record_id": "record-synthetic-0001",
  "relation": "CORRECTS",
  "source_ref": "source-synthetic-0001",
  "observed_at": "2026-08-01T00:00:00Z",
  "recorded_at": "2026-08-27T00:00:00Z",
  "content_hash": "sha256:3333333333333333333333333333333333333333333333333333333333333333",
  "access_state": "AVAILABLE"
}
